{
	"id": "restaurant-workflow",
	"name": "Restaurant Ordering Workflow",
	"version": "1.0",
	"description": "A workflow for taking restaurant orders with menu browsing, ordering, and checkout",
	"entry_node_id": "welcome",
	"global_tools": [],
	"nodes": [
		{
			"id": "welcome",
			"type": "welcome",
			"name": "Welcome Guest",
			"description": "Greet the customer and present main options",
			"prompt": {
				"system_prompt": "You are a friendly restaurant host. Welcome guests and guide them to either browse the menu or place an order.",
				"instructions": "Warmly welcome the guest to the restaurant. Ask if they'd like to hear about menu items or if they're ready to order.",
				"max_tokens": 120,
				"temperature": 0.8
			},
			"tools": [],
			"transitions": [
				{
					"target_node_id": "menu_browsing",
					"condition": {
						"type": "intent",
						"intent_description": "Customer wants to see the menu, hear about items, or learn about available dishes"
					},
					"priority": 10
				},
				{
					"target_node_id": "taking_order",
					"condition": {
						"type": "intent",
						"intent_description": "Customer is ready to place an order"
					},
					"priority": 10
				}
			],
			"preserve_chat_context": false
		},
		{
			"id": "menu_browsing",
			"type": "tool",
			"name": "Menu Browsing",
			"description": "Help customers explore menu items",
			"prompt": {
				"system_prompt": "You are a knowledgeable server who knows the menu well. Help customers learn about dishes, ingredients, and specials. Be descriptive and appetizing in your descriptions.",
				"instructions": "Present menu categories and items. Answer questions about ingredients, preparation, and recommendations. When the customer is ready, help them transition to ordering.",
				"max_tokens": 200,
				"temperature": 0.8
			},
			"tools": ["get_menu_items", "get_item_details", "get_daily_specials"],
			"transitions": [
				{
					"target_node_id": "taking_order",
					"condition": {
						"type": "intent",
						"intent_description": "Customer is ready to place their order"
					},
					"priority": 10
				},
				{
					"target_node_id": "welcome",
					"condition": {
						"type": "intent",
						"intent_description": "Customer wants to start over or go back"
					},
					"priority": 5
				}
			],
			"preserve_chat_context": true
		},
		{
			"id": "taking_order",
			"type": "tool",
			"name": "Order Taking",
			"description": "Take the customer's order",
			"prompt": {
				"system_prompt": "You are taking the customer's order. Be attentive, confirm each item, ask about modifications, and ensure accuracy.",
				"instructions": "Ask what they'd like to order. Confirm each item, check for modifications or special requests, and repeat the order back for accuracy.",
				"max_tokens": 200,
				"temperature": 0.7
			},
			"tools": [
				"add_item_to_order",
				"remove_item",
				"modify_item",
				"view_current_order"
			],
			"transitions": [
				{
					"target_node_id": "order_confirmation",
					"condition": {
						"type": "intent",
						"intent_description": "Customer has finished adding items and wants to complete the order"
					},
					"priority": 10
				},
				{
					"target_node_id": "menu_browsing",
					"condition": {
						"type": "intent",
						"intent_description": "Customer wants to hear more about menu items before deciding"
					},
					"priority": 8
				}
			],
			"preserve_chat_context": true
		},
		{
			"id": "order_confirmation",
			"type": "transition",
			"name": "Order Confirmation",
			"description": "Confirm the complete order and transition to checkout",
			"prompt": {
				"system_prompt": "You are confirming the customer's order. Be clear and thorough.",
				"instructions": "Read back the complete order with all items and modifications. Ask if everything is correct, then proceed to checkout.",
				"max_tokens": 150,
				"temperature": 0.6
			},
			"tools": ["view_order_summary"],
			"transitions": [
				{
					"target_node_id": "checkout",
					"condition": {
						"type": "intent",
						"intent_description": "Customer confirms the order is correct"
					},
					"priority": 10
				},
				{
					"target_node_id": "taking_order",
					"condition": {
						"type": "intent",
						"intent_description": "Customer wants to make changes to the order"
					},
					"priority": 9
				}
			],
			"preserve_chat_context": true
		},
		{
			"id": "checkout",
			"type": "tool",
			"name": "Checkout",
			"description": "Process payment and delivery details",
			"prompt": {
				"system_prompt": "You are processing the checkout. Collect delivery or pickup information and payment details professionally.",
				"instructions": "Ask for delivery address or pickup preference. Get payment information and provide an estimated time for the order.",
				"max_tokens": 150,
				"temperature": 0.6
			},
			"tools": ["process_payment", "schedule_delivery", "schedule_pickup"],
			"transitions": [
				{
					"target_node_id": "order_complete",
					"condition": {
						"type": "tool_result",
						"tool_name": "process_payment",
						"expected_value": true
					},
					"priority": 10
				}
			],
			"preserve_chat_context": true
		},
		{
			"id": "order_complete",
			"type": "hangup",
			"name": "Order Complete",
			"description": "Confirm order completion and end call",
			"prompt": {
				"system_prompt": "You are completing the order transaction.",
				"instructions": "Thank the customer for their order, confirm the delivery/pickup time, and end the call warmly.",
				"max_tokens": 100,
				"temperature": 0.7
			},
			"tools": [],
			"transitions": [],
			"preserve_chat_context": false
		}
	]
}
